messageKey,,en,de,es,fr,pt,ru
blueprint.horizons.type.description.ammo_capacity,"Increases the module''s ammo capacity, but at the cost of increased reload time and mass.","Increases the module''s ammo capacity, but at the cost of increased reload time and mass.","Erhöht die Munitionskapazität des Moduls, jedoch auf Kosten einer erhöhten Nachladezeit und -masse.","Aumenta la capacidad de munición del módulo, pero a costa del aumento del tiempo y la masa de la recarga.","Augmente la capacité des munitions du module, mais au prix d''augmenter le temps et la masse de rechargement.","Aumenta a capacidade de munição do módulo, mas ao custo do aumento do tempo e da massa de recarga.",Увеличивает максимальное количество припасов за счёт увеличения времени перезарядки и массы.
blueprint.horizons.type.description.angled_plating,"Custom angling of plates at critical points along the ship''s hull make projectile strikes more likely to glance, reducing the impact of kinetic damage at the cost of structural integrity.","Custom angling of plates at critical points along the ship''s hull make projectile strikes more likely to glance, reducing the impact of kinetic damage at the cost of structural integrity.","Das kundenspezifische Angeln von Platten an kritischen Punkten entlang des Schiffsrumpfes macht Projektilangriffe wahrscheinlicher, wodurch die Auswirkungen kinetischer Schäden auf Kosten der strukturellen Integrität verringert werden.","La pesca personalizada de las placas en puntos críticos a lo largo del casco de la nave hace que los golpes de proyectiles sean más propensos a mirar, reduciendo el impacto del daño cinético a costa de la integridad estructural.","La pêche personnalisée des plaques aux points critiques le long de la coque du navire rend les frappes projectiles plus susceptibles de jeter un coup d''œil, réduisant l''impact des dommages cinétiques au prix de l''intégrité structurelle.","A pesca personalizada de placas em pontos críticos ao longo do casco do navio torna as greves do projétil mais propensas a olhar, reduzindo o impacto do dano cinético ao custo da integridade estrutural.","лагодаря расположению пластин обшивки под разными углами снаряды при попадании идут по касательной. При этом сопротивление кинетическому урону повышается, а структурная целостность снижается."
blueprint.horizons.type.description.armoured,"Module integrity is improved with this blueprint, allowing small improvements to power generation and heat efficiency, at the cost of increased mass.","Module integrity is improved with this blueprint, allowing small improvements to power generation and heat efficiency, at the cost of increased mass.",Die Modulintegrität wird durch diese Blaupause verbessert und ermöglicht eine geringe Verbesserung der Stromerzeugung und Wärmeeffizienz auf Kosten einer erhöhten Masse.,"La integridad del módulo se mejora con este plan, lo que permite pequeñas mejoras para la generación de energía y la eficiencia del calor, a costa del aumento de la masa.","L''intégrité du module est améliorée avec ce plan, permettant de petites améliorations à la génération d''énergie et à l''efficacité thermique, au prix de l''augmentation de la masse.","A integridade do módulo é aprimorada com esse plano, permitindo pequenas melhorias na geração de energia e na eficiência do calor, ao custo do aumento da massa.","Чертёж увеличивает целостность модуля, незначительно улучшает его тепловую отдачу и теплоэффективность, но увеличивает его массу."
blueprint.horizons.type.description.auto_loader,"An experimental upgrade that automatically reloads the weapon, even when firing.","An experimental upgrade that automatically reloads the weapon, even when firing.","Ein experimentelles Upgrade, das die Waffe automatisch neu lädt, auch beim Schießen.","Una actualización experimental que recarga automáticamente el arma, incluso cuando se dispara.","Une mise à niveau expérimentale qui recharge automatiquement l''arme, même lors du tir.","Uma atualização experimental que recarrega automaticamente a arma, mesmo quando dispara.","Экспериментальное улучшение, автоматически перезаряжающее оружие. Работает даже во время стрельбы."
blueprint.horizons.type.description.blast_block,"Advanced field resonation patterns increase resistance to explosive damage, at the cost of overall shield strength.","Advanced field resonation patterns increase resistance to explosive damage, at the cost of overall shield strength.",Fortgeschrittene Feldresonationsmuster erhöhen den Widerstand gegen explosive Schäden auf Kosten der Gesamtschildstärke.,"Los patrones avanzados de resonación de campo aumentan la resistencia al daño explosivo, a costa de la resistencia general del escudo.","Les modèles avancés de résonance du champ augmentent la résistance aux dommages explosifs, au prix de la force globale du bouclier.","Os padrões avançados de ressonação de campo aumentam a resistência a danos explosivos, ao custo da força geral do escudo.",Улучшенные резонирующие механизмы щита повышают споротивление урону от взрывов за счёт снижения общей мощности щита.
blueprint.horizons.type.description.blast_resistant,Kinetic and thermal resistance is lost to gain better explosive damage resistance with this blueprint.,Kinetic and thermal resistance is lost to gain better explosive damage resistance with this blueprint.,"Der kinetische und thermische Widerstand geht verloren, um mit dieser Blaupause einen besseren explosiven Schadenswiderstand zu gewinnen.",La resistencia cinética y térmica se pierde para obtener una mejor resistencia al daño explosivo con este plan.,La résistance cinétique et thermique est perdue pour gagner une meilleure résistance aux dommages explosifs avec ce plan.,A resistência cinética e térmica é perdida para obter uma melhor resistência a danos explosivos com esse plano.,"Чертёж снижает сопротивление механическому и термальному урону, но увеличивает сопротивление взрывам."
blueprint.horizons.type.description.blast_resistant_hull_reinforcement,"With this modification kinetic and thermal resistance is reduced, but with the benefit of improved explosion resistance and a small integrity increase.","With this modification kinetic and thermal resistance is reduced, but with the benefit of improved explosion resistance and a small integrity increase.","Mit dieser Modifikation wird der kinetische und thermische Widerstand verringert, aber mit einem verbesserten Explosionsbeständigkeit und einer geringen Integritätserhöhung.","Con esta modificación, se reduce la resistencia cinética y térmica, pero con el beneficio de una resistencia a la explosión mejorada y un pequeño aumento de integridad.","Avec cette modification, la résistance cinétique et thermique est réduite, mais avec l''avantage d''une amélioration de la résistance à l''explosion et d''une petite augmentation d''intégrité.","Com essa modificação, a resistência cinética e térmica é reduzida, mas com o benefício de melhorar a resistência à explosão e um pequeno aumento de integridade.","Модификация снижает сопротивление кинетическому и термическому урону, но увеличивает сопротивление взрывам и незначительно улучшает целостность корпуса."
blueprint.horizons.type.description.bobblehead,Thargoid Interceptor bobblehead cosmetic item that can be placed inside the cockpit.,Thargoid Interceptor bobblehead cosmetic item that can be placed inside the cockpit.,"Thargoid Interceptor Bobblehead Kosmetisches Element, das in das Cockpit platziert werden kann.",Interceptor Thargoid Bobblehead elemento cosmético que se puede colocar dentro de la cabina.,Élément cosmétique Bobblehead intercepteur thargoïde qui peut être placé à l''intérieur du cockpit.,Thargoid Interceptor Bobblehead Cosmetic Item que pode ser colocado dentro do cockpit.,"Таргоидский перехватчик (Кивающая фигура). Косметический элемент, который можно помещать в кабину."
blueprint.horizons.type.description.boss_cells,Oversized cells offer increased cell strength at cost of an increased spin up time.,Oversized cells offer increased cell strength at cost of an increased spin up time.,Übergroße Zellen bieten eine erhöhte Zellstärke zum Preis einer erhöhten Spin -Up -Zeit.,Las células de gran tamaño ofrecen una mayor resistencia celular al costo de un mayor tiempo de giro.,Les cellules surdimensionnées offrent une force cellulaire accrue au coût d''une augmentation du temps de rotation.,As células de grandes dimensões oferecem maior força celular ao custo de um tempo aumentado de rotação.,"Увеличение размера даёт ячейкам повышенную мощность, но время раскрутки возрастает."
blueprint.horizons.type.description.charge_enhanced,This blueprint impacts overall power capacity while providing a faster overall charge rate.,This blueprint impacts overall power capacity while providing a faster overall charge rate.,Diese Blaupause wirkt sich auf die Gesamtleistung der Leistung aus und bietet gleichzeitig eine schnellere Gesamtladungsrate.,Este plan afecta la capacidad de potencia general al tiempo que proporciona una tasa de carga general más rápida.,Ce plan a un impact sur la capacité d''énergie globale tout en offrant un taux de charge global plus rapide.,"Esse projeto afeta a capacidade geral de energia, fornecendo uma taxa de cobrança geral mais rápida.","Чертёж сокращает время зарядки модуля, однако ухудшает его общую мощность."
blueprint.horizons.type.description.clean_drive_tuning,Power draw and mass requirements are sacrificed for better thermal handling and performance with this enhancement.,Power draw and mass requirements are sacrificed for better thermal handling and performance with this enhancement.,Die Anforderungen an die Kraft und Massenanforderungen werden mit dieser Verbesserung für eine bessere thermische Handhabung und Leistung geopfert.,El sorteo de potencia y los requisitos de masa se sacrifican para un mejor manejo térmico y rendimiento con esta mejora.,Le tirage au sort et les exigences de masse sont sacrifiés pour une meilleure manipulation thermique et des performances avec cette amélioration.,Os requisitos de desenho de energia e massa são sacrificados por melhor manuseio térmico e desempenho com esse aprimoramento.,"Эта модификация снижает тепловую отдачу и улучшает производительность двигателя, что отрицательно сказывается на его силовой нагрузке и массе."
blueprint.horizons.type.description.cluster_capacitor,Additional capacitor arrays allow the power distributor to store more energy at the cost of a slower charging rate.,Additional capacitor arrays allow the power distributor to store more energy at the cost of a slower charging rate.,"Zusätzliche Kondensatorarrays ermöglichen es dem Stromverteiler, mehr Energie auf Kosten einer langsameren Ladequote zu speichern.",Las matrices de condensadores adicionales permiten al distribuidor de energía almacenar más energía a costa de una tasa de carga más lenta.,Des réseaux de condensateurs supplémentaires permettent au distributeur d''énergie de stocker plus d''énergie au prix d''un taux de charge plus lent.,Matrizes de capacitores adicionais permitem que o distribuidor de energia armazene mais energia ao custo de uma taxa de carregamento mais lenta.,Дополнительные системы конденсаторов повышают энергоёмкость распределителя питания за счёт замедления зарядки.
blueprint.horizons.type.description.concordant_sequence,"A modification that causes weapon strikes to temporarily enhance the regeneration rate of a wingman''s shield, at the cost of increased heat generation.","A modification that causes weapon strikes to temporarily enhance the regeneration rate of a wingman''s shield, at the cost of increased heat generation.","Eine Modifikation, die dazu führt, dass Waffenangriffe die Regenerationsrate eines Wingman -Schildes auf Kosten einer erhöhten Wärmeerzeugung vorübergehend verbessern.","Una modificación que hace que los golpes de armas mejoren temporalmente la tasa de regeneración del escudo de un ala, a costa de una mayor generación de calor.","Une modification qui fait que les frappes d''armes améliorent temporairement le taux de régénération du bouclier d''un ailier, au prix de l''augmentation de la production de chaleur.","Uma modificação que faz com que as ataques de armas aumentem temporariamente a taxa de regeneração do escudo de um ala, à custa do aumento da geração de calor.","Модификация, которая заставляет оружие временно повысить скорость регенерации щита в крыле, за счет увеличения тепла."
blueprint.horizons.type.description.corrosion_resistant_cargo_rack,Specialised storage rack for use in automated cargo transfer system that can resist the effects of corrosive cargo. This blueprint provides 2D and 4D cargo rack sizes.,Specialised storage rack for use in automated cargo transfer system that can resist the effects of corrosive cargo. This blueprint provides 2D and 4D cargo rack sizes.,"Spezialer Speicherregal zur Verwendung im automatisierten Frachtübertragungssystem, das den Auswirkungen einer korrosiven Fracht widerstehen kann. Dieser Blaupause bietet 2D- und 4D -Frachtregalgrößen.",Ratch de almacenamiento especializado para su uso en un sistema automatizado de transferencia de carga que puede resistir los efectos de la carga corrosiva. Este plan proporciona tamaños de estante de carga 2D y 4D.,Rack de stockage spécialisé à utiliser dans le système de transfert de cargaison automatisé qui peut résister aux effets de la cargaison corrosive. Ce plan fournit des tailles de rack de cargaison 2D et 4D.,Rack de armazenamento especializado para uso no sistema de transferência de carga automatizado que pode resistir aos efeitos da carga corrosiva. Este plano fornece tamanhos de rack de carga 2D e 4D.,"Грузовой стеллаж, специально созданный для безопасной перевозки едких веществ. Совместим с автоматическими системами для перевозки грузов в ангарных отсеках."
blueprint.horizons.type.description.corrosive_shell,"Experimental rounds that temporarily weaken hull hardness and increase all damage taken, at the cost of reduced ammo capacity.","Experimental rounds that temporarily weaken hull hardness and increase all damage taken, at the cost of reduced ammo capacity.","Experimentelle Runden, die die Hullhärte vorübergehend schwächen und alle angenommenen Schäden auf Kosten einer reduzierten Munitionskapazität erhöhen.","Las rondas experimentales que debilitan temporalmente la dureza del casco y aumentan todo el daño recibido, a costa de una capacidad de munición reducida.","Les cycles expérimentaux qui affaiblissent temporairement la dureté de la coque et augmentent tous les dommages causés, au prix d''une capacité de munitions réduite.","Rodadas experimentais que enfraquecem temporariamente a dureza do casco e aumentam todos os danos causados, ao custo da capacidade reduzida de munição.","Экспериментальные снаряды, снижающие плотность корпуса цели и увеличивающие получаемый ей урон. Установка этой модификации снижает общий боезапас орудия."
blueprint.horizons.type.description.dazzle_shell,Experimental shells that temporarily reduce a target''s sensor acuity upon impact.,Experimental shells that temporarily reduce a target''s sensor acuity upon impact.,"Experimentelle Schalen, die die Sensorschärfe eines Ziels beim Aufprall vorübergehend reduzieren.",Conchas experimentales que reducen temporalmente la agudeza del sensor de un objetivo sobre el impacto.,Des obus expérimentaux qui réduisent temporairement l''acuité du capteur d''une cible lors de l''impact.,Cascas experimentais que reduzem temporariamente a acuidade do sensor de um alvo após o impacto.,"Экспериментальные снаряды, снижающие эффективность работы сенсоров при попадании."
blueprint.horizons.type.description.deep_charge,"Toughened FSD power conduits and a reinforced charging field increase the amount of fuel injected when charging, allowing larger jumps at the cost of increased power draw.","Toughened FSD power conduits and a reinforced charging field increase the amount of fuel injected when charging, allowing larger jumps at the cost of increased power draw.","Zartigte FSD -Stromleitungen und ein verstärktes Ladefeld erhöhen die Menge an Kraftstoffmengen, die beim Ladungen injiziert werden, und ermöglicht größere Sprünge auf Kosten einer erhöhten Leistung.","Los conductos de potencia FSD endurecidos y un campo de carga reforzado aumentan la cantidad de combustible inyectado al cargar, permitiendo saltos mayores a costa de aumento de la potencia.","Les conduits de puissance FSD durcies et un champ de charge renforcé augmentent la quantité de carburant injecté lors du chargement, permettant des sauts plus importants au coût d''une augmentation du tirage de puissance.","Os condutos de energia FSD endurecidos e um campo de carregamento reforçado aumentam a quantidade de combustível injetado ao carregar, permitindo saltos maiores à custa do aumento do consumo de energia.",Укреплённые энергопроводники FSD и усиленное заряжающее поле повышают затраты топлива на зарядку. При этом растёт как дальность прыжка так и энергопотребление.
blueprint.horizons.type.description.deep_plating,"Increased depth of plating increases the ship''s overall structural integrity, at the cost of resistance against all types of damage.","Increased depth of plating increases the ship''s overall structural integrity, at the cost of resistance against all types of damage.",Eine erhöhte Überlagerungstiefe erhöht die strukturelle Integrität des Schiffes auf Kosten des Widerstands gegen alle Arten von Schäden.,"El aumento de la profundidad del enchapado aumenta la integridad estructural general de la nave, a costa de resistencia a todo tipo de daños.","Une profondeur accrue du placage augmente l''intégrité structurelle globale du navire, au prix de la résistance par rapport à tous les types de dommages.","O aumento da profundidade de revestimento aumenta a integridade estrutural geral do navio, ao custo de resistência contra todos os tipos de danos.",Более толстая броня повышает общую структурную целостность корабля за счёт снижения сопротивления всем типам урона.
blueprint.horizons.type.description.dirty_drive_tuning,"With this blueprint, a drive''s integrity, thermal load and power draw are sacrificed for increased performance.","With this blueprint, a drive''s integrity, thermal load and power draw are sacrificed for increased performance.","Mit dieser Blaupause werden die Integrität, die thermische Belastung und die Kraft des Laufwerks für eine erhöhte Leistung geopfert.","Con este plan, la integridad de un disco, la carga térmica y el sorteo de energía se sacrifican por un mayor rendimiento.","Avec ce plan, l''intégrité d''un lecteur, la charge thermique et le tirage de puissance sont sacrifiés pour des performances accrues.","Com esse plano, a integridade de uma unidade, a carga térmica e o desenho de potência são sacrificados para aumentar o desempenho.","Этот чертёж увеличивает производительность двигателя, но снижает его целостность, а также тепловую и силовую нагрузки."
blueprint.horizons.type.description.dispersal_field,"Experimental upgrade that causes successful strikes to temporarily confuse all gimbal and turret hardpoints on the target, at the cost of direct damage potential.","Experimental upgrade that causes successful strikes to temporarily confuse all gimbal and turret hardpoints on the target, at the cost of direct damage potential.","Experimentelles Upgrade, bei dem erfolgreiche Streiks vorübergehend alle Gimbal- und Turmhartpunkte des Ziels auf Kosten eines direkten Schadenspotenzials verwirren.","La actualización experimental que hace que las huelgas exitosas confundan temporalmente todos los puntos duros de cardán y torreta en el objetivo, a costa del potencial de daño directo.","Une mise à niveau expérimentale qui fait que les frappes réussies confondent temporairement tous les points durs cardan et de la tourelle sur la cible, au prix du potentiel de dommages directs.","Atualização experimental que faz com que ataques bem -sucedidos confundem temporariamente todos os hardpoints de cardan e torre no alvo, com o custo do potencial de danos diretos.","Экспериментальное улучшение, снижающее потенциальный тепловой урон, но позволяющее временно сбить с наводки орудия на карданной подвеске и турельной установки цели."
blueprint.horizons.type.description.double_braced,"Additional, hardened supports and bracing further improve module survivability.","Additional, hardened supports and bracing further improve module survivability.","Zusätzliche, hartgesottene Stützen und Verbreiten verbessern die Überlebensfähigkeit des Moduls weiter.",Los soportes adicionales y endurecidos y los refuerzos mejoran aún más la supervivencia del módulo.,Les supports supplémentaires et durcis et le contreventement améliorent encore la survie des modules.,Suportes e suporte adicionais e endurecidos melhoram ainda mais a sobrevivência do módulo.,Дополнительные опоры и крепёж повышают прочность модуля.
blueprint.horizons.type.description.double_shot,"This weapon modification enables a double shot burst of fire per trigger pull, but at a cost of decreased range.","This weapon modification enables a double shot burst of fire per trigger pull, but at a cost of decreased range.","Diese Waffenmodifikation ermöglicht einen doppelten Schussfeuerburst pro Abzug, aber zu einem Preis für verringerte Reichweite.","Esta modificación de armas permite una explosión de fuego de doble disparo por tirador del gatillo, pero a un costo de disminución del rango.","Cette modification de l''arme permet une rupture de tir à double tir par tir, mais à un coût d''une plage diminuée.","Essa modificação de armas permite uma explosão de disparo duplo por gatilho, mas a um custo de diminuição da faixa.","Модификация даёт возможность производить два выстрела за раз, но снижает радиус орудия."
blueprint.horizons.type.description.drag_drives,Removal of safety protocols in controller software to increase drive thrust output at the cost of additional heat generation.,Removal of safety protocols in controller software to increase drive thrust output at the cost of additional heat generation.,Entfernung von Sicherheitsprotokollen in der Controller -Software zur Erhöhung der Antriebsschubleistung auf Kosten der zusätzlichen Wärmeerzeugung.,Eliminación de los protocolos de seguridad en el software del controlador para aumentar la salida de empuje de la unidad a costa de la generación de calor adicional.,Élimination des protocoles de sécurité dans le logiciel du contrôleur pour augmenter la sortie de poussée d''entraînement au prix de la génération de chaleur supplémentaire.,Remoção de protocolos de segurança no software do controlador para aumentar a saída de impulso de acionamento ao custo de geração de calor adicional.,Протоколы безопасности в программном обеспечении контроллера отключаются. Повышается выработка тепла.
